{
  "record_id": "aud_9001",
  "chain": "org_456/shard-0",
  "sequence": 4812,
  "previous_hash": "sha256:9f2c1e7ab4d0",
  "record_hash": "sha256:9f2c1e7ab4d0",
  "at": "2026-09-20T09:00:00.480Z",
  "tenant": "org_456",
  "kind": "decision",
  "identity": {
    "mode": "unattended",
    "subject": "user_123",
    "actor_chain": [
      "accounts-payable-fte"
    ],
    "subject_authority": {
      "source": "role_source",
      "as_of": "2026-09-20T08:45:00Z"
    }
  },
  "delegation": "del_100",
  "operation": "payment.execute@1",
  "resources": [
    "dsor://org_456/payment/PAY-901",
    "dsor://org_456/invoice/INV-1008",
    "dsor://org_456/vendor/VENDOR-44"
  ],
  "payload_hash": "sha256:9f2c1e7ab4d0",
  "authorization": "ALLOW",
  "controls": [
    {
      "id": "high-value-payment",
      "version": 8,
      "outcome": "REQUIRE_APPROVAL",
      "satisfied_by": [
        "apr_555"
      ],
      "authority": {
        "system": "ksor",
        "uri": "ksor://org_456/finance/payment-approval-policy",
        "rule": "high-value-payment",
        "version": 4,
        "content_hash": "sha256:9f2c1e7ab4d0"
      }
    }
  ],
  "approval": "apr_555",
  "connector": "postgres",
  "semantics": "non_compensatable",
  "result": "committed",
  "decision_bundle": "dec_123",
  "correlation": {
    "request_id": "req_1",
    "trace_id": "tr_9",
    "tenant_id": "org_456",
    "agent_id": "accounts-payable-fte"
  }
}